text,label,text_en,text_hi,text_bn,text_mr,text_te,text_ta,text_gu,text_ur,text_kn,text_or,text_ml
Dark railway crossing causes near-miss accidents daily.,streetlight,Dark railway crossing causes near-miss accidents daily.,गहरे रेलवे पार करने के कारण हर दिन दुर्घटनाओं का कारण होता है।,अंधाऱ्‍या रेल्वेवरून जाणारा रेल्वे - मिशीच्या दुर्घटना दररोज घडतात.,षडकुवा-वाळण-वापरी-वाळण-वाळण-वाळण-हैर-हल-हल-हल-हल-हल-हल-ज-हल-हल-हल-हल-ज-हल-ज-ज-हल-हल-ज-हल-ज-हल-ज-ज-ज-हल-ज-ज-हल-हल-ज-हल-हल-हता-हल-हता-हता-,రోడ్డ వాయుగుండా ప్రతిరోజు விபத்துలకు సమీపంలోనే కారణాలు ఉన్నాయి.,రోడ్డ వాయుగుండా ప్రతిరోజు விபத்துలకు సమీపంలోనే కారణాలు ఉన్నాయి.,अंधाऱ्‍या रेल्वेवरून जाणारा रेल्वे - मिशीच्या दुर्घटना दररोज घडतात.,سیاہ گاڑیوں کی رفتار ہر روز کے حادثات کا سبب بنتی ہے۔,రోడ్డ వాయుగుండా ప్రతిరోజు விபத்துలకు సమీపంలోనే కారణాలు ఉన్నాయి.,अंधाऱ्‍या रेल्वेवरून जाणारा रेल्वे - मिशीच्या दुर्घटना दररोज घडतात.,ഇരുണ്ട റെയിൽപ്പാത ദിവസവും അപകടം സംഭവിക്കാൻ ഇടയാക്കുന്നു.
Security cameras blind due to streetlight failure.,streetlight,Security cameras blind due to streetlight failure.,सड़क सड़क विफलता के कारण सुरक्षा कैमरा अंधे.,सड़कlight ناکام ਹੋਣ ਕਰਕੇ सुरक्षा ক্যামেরাઓ අන්ධ হয়ে গেছে।,भीतीपासून मुक् त होणे.,వీధి లైట్ ವೈಫಲ್ಯ వల్ల భద్రతా కెమెరాలు అంధులవుతాయి.,వీధి లైట్ ವೈಫಲ್ಯ వల్ల భద్రతా కెమెరాలు అంధులవుతాయి.,सड़कlight ناکام ਹੋਣ ਕਰਕੇ सुरक्षा ক্যামেরাઓ අන්ධ হয়ে গেছে।,سیکورٹی گاڑیوں کی وجہ سے سڑکوں کی ناکامی ہو گئی.,వీధి లైట్ ವೈಫಲ್ಯ వల్ల భద్రతా కెమెరాలు అంధులవుతాయి.,सड़कlight ناکام ਹੋਣ ਕਰਕੇ सुरक्षा ক্যামেরাઓ අන්ධ হয়ে গেছে।,സുരക്ഷാ ക്യാമറകൾ തെരുവ് ലൈറ്റിന്റെ പരാജയം കൊണ്ട് കണ്ണുപൊട്ടുന്നു.
Shopping street dark after business hours daily.,streetlight,Shopping street dark after business hours daily.,व्यापार घंटे प्रतिदिन के बाद सड़क अंधेरे.,बिज़नेस घंटों बाद खरीदारी करना,प्रत्येक रात्री पाऊस पडतो.,ವ್ಯಾಪಾರ - ವಹಿವಾಟುಗಳು ದಿನಕ್ಕೆ ಎರಡಾವರ್ತಿ ರಸ್ತೆಬದಿಯಲ್ಲಿ ರಸ್ತೆಬದಿಯ ಅಂಧಕಾರದಲ್ಲಿದೆ.,ವ್ಯಾಪಾರ - ವಹಿವಾಟುಗಳು ದಿನಕ್ಕೆ ಎರಡಾವರ್ತಿ ರಸ್ತೆಬದಿಯಲ್ಲಿ ರಸ್ತೆಬದಿಯ ಅಂಧಕಾರದಲ್ಲಿದೆ.,बिज़नेस घंटों बाद खरीदारी करना,کاروباری دنوں کے بعد سڑکوں پر کاروباری کام کے بعد کاروباری طور پر بحث‌وتکرار کرتا ہے ۔,ವ್ಯಾಪಾರ - ವಹಿವಾಟುಗಳು ದಿನಕ್ಕೆ ಎರಡಾವರ್ತಿ ರಸ್ತೆಬದಿಯಲ್ಲಿ ರಸ್ತೆಬದಿಯ ಅಂಧಕಾರದಲ್ಲಿದೆ.,बिज़नेस घंटों बाद खरीदारी करना,ബിസിനസ് മണിക്കൂറുകൾക്കു ശേഷം തെരുവ് നിറയുന്നു.
Streetlights turn on past 9 PM regularly now.,streetlight,Streetlights turn on past 9 PM regularly now.,सड़क की बारी पिछले 9 अल्लाह की आज नियमित रूप से चलती है.,स्ट्राइटस्‌ की रोटियाँ बीते 9 बएम को नियमित रूप से चालू होती हैं.,१: १ - ३; २: १ - ३; ४: १ - ४; ६: १ - ६; ७: १ - ४.,గత 9 PM(PM) స్ట్రీట్‌లు ఇప్పుడు క్రమంగా ప్రారంభమయ్యాయి.,గత 9 PM(PM) స్ట్రీట్‌లు ఇప్పుడు క్రమంగా ప్రారంభమయ్యాయి.,स्ट्राइटस्‌ की रोटियाँ बीते 9 बएम को नियमित रूप से चालू होती हैं.,ماضی کی سڑکوں پر سڑکیں باقاعدگی سے رُک جاتی ہیں ۔,గత 9 PM(PM) స్ట్రీట్‌లు ఇప్పుడు క్రమంగా ప్రారంభమయ్యాయి.,स्ट्राइटस्‌ की रोटियाँ बीते 9 बएम को नियमित रूप से चालू होती हैं.,9 പി.എം.
Timer mechanism completely broken on all poles.,streetlight,Timer mechanism completely broken on all poles.,सभी काफिरों पर टाइमर प्रणाली पूरी तरह से टूट गई.,टाइमर यांत्रिकी सर्व दांडे पर पूर्णतः तुटलेली है।,शोध पानाच्या सर्व वस्तू नष्ट करा.,టైమర్ സംവിധാനము అన్ని డెస్‍క్ టాప్‌లపైనూ పూర్తిగా విరిగింది.,టైమర్ സംവിധാനము అన్ని డెస్‍క్ టాప్‌లపైనూ పూర్తిగా విరిగింది.,टाइमर यांत्रिकी सर्व दांडे पर पूर्णतः तुटलेली है।,وقت گزرنے کیساتھ ساتھ تمام کمروں کو مکمل طور پر توڑ دیا جاتا ہے ۔,టైమర్ സംവിധാനము అన్ని డెస్‍క్ టాప్‌లపైనూ పూర్తిగా విరిగింది.,टाइमर यांत्रिकी सर्व दांडे पर पूर्णतः तुटलेली है।,ടൈമർ സംവിധാനം എല്ലാ തണ്ടുകളിലും ഒടിഞ്ഞു.
Wild animals enter colony due to total darkness.,streetlight,Wild animals enter colony due to total darkness.,जंगली जानवर कुल अन्धकार के कारण बस्ती में प्रवेश करते हैं।,जंगली जानवर कुल अँधेरे की वजह से बस्ती ਵਿਚ प्रवेश करते हैं ।,डोंगरावर भरपूर पक्षी राहतात.,ಕಾಡುಮೃಗಗಳು పూర్తిగా ಕರಾಳ ಕತ್ತಲಿನ ಕಾರಣ ಕಾಲುವೆಯೊಳಗೆ ಪ್ರವೇಶಿಸುತ್ತವೆ.,ಕಾಡುಮೃಗಗಳು పూర్తిగా ಕರಾಳ ಕತ್ತಲಿನ ಕಾರಣ ಕಾಲುವೆಯೊಳಗೆ ಪ್ರವೇಶಿಸುತ್ತವೆ.,जंगली जानवर कुल अँधेरे की वजह से बस्ती ਵਿਚ प्रवेश करते हैं ।,جنگلی جانور مکمل تاریکی میں داخل ہوتے ہیں ۔,ಕಾಡುಮೃಗಗಳು పూర్తిగా ಕರಾಳ ಕತ್ತಲಿನ ಕಾರಣ ಕಾಲುವೆಯೊಳಗೆ ಪ್ರವೇಶಿಸುತ್ತವೆ.,जंगली जानवर कुल अँधेरे की वजह से बस्ती ਵਿਚ प्रवेश करते हैं ।,"""വൈൽഡ്"" (Wild History), പൂർണ്ണമായും അന്ധകാരം കാരണം കോളനിയിലേക്ക് പ്രവേശിക്കുന്നു."
Cycling track unlit posing risks to fitness enthusiasts.,streetlight,Cycling track unlit posing risks to fitness enthusiasts.,ध्वनियों के लिए जोखिमों का सामना करना।,▪ ▪ मोटार गाड़ी चलाना — ▪ (w13 - E 05 / 01) [ ਫੁਟਨੋ,या रोगाचे प्रमाण वाढत चालले आहे.,ఆరోగ్య సంరక్షణలకు అతీంద్రియ శక్తులను అరికట్టడం.,ఆరోగ్య సంరక్షణలకు అతీంద్రియ శక్తులను అరికట్టడం.,▪ ▪ मोटार गाड़ी चलाना — ▪ (w13 - E 05 / 01) [ ਫੁਟਨੋ,اِس سلسلے میں ایک مثال پر غور کریں ۔,ఆరోగ్య సంరక్షణలకు అతీంద్రియ శక్తులను అరికట్టడం.,▪ ▪ मोटार गाड़ी चलाना — ▪ (w13 - E 05 / 01) [ ਫੁਟਨੋ,സിക്യൂട്ടിങ് ട്രാക്ക് എൻസൈസിസ്റ്റുകൾക്കു ചേരാനുള്ള സാധ്യത വർധിപ്പിക്കുന്നു.
Women avoid night shifts due to dark commute.,streetlight,Women avoid night shifts due to dark commute.,"लेकिन कुछ ही समय बाद, वे अपने घर से बाहर निकलने की कोशिश करते हैं ।",▪ ▪ ▪ (g13 - E 02),स्त्रिया रात्रीच्या वेळी झोपी जातात.,చీకటిയാത്ര കാരണം స్త్రీలు రాత్రి రీతుల్లో మారడం ഒഴിവാക്കుకుంటారు.,చీకటిയാത്ര കാരണം స్త్రీలు రాత్రి రీతుల్లో మారడం ഒഴിവാക്കుకుంటారు.,▪ ▪ ▪ (g13 - E 02),عورتیں اندھیرے میں رات کو کم کرنے سے گریز کرتی ہیں ۔,చీకటిയാത്ര കാരണം స్త్రీలు రాత్రి రీతుల్లో మారడం ഒഴിവാക്കుకుంటారు.,▪ ▪ ▪ (g13 - E 02),സ്ത്രീകൾ രാത്രി ഷിഫ്റ്റ് ഒഴിവാക്കുന്നു. കാരണം ഇരുട്ട് കലർന്നത് കൊണ്ട്.
Brand new streetlights lying unused on roadside.,streetlight,Brand new streetlights lying unused on roadside.,Brand के नए सड़क की रोशनी सड़क के किनारे पड़ी हुई है.,ब्रांड नयी सड़कों पर कसबे में टकराते - कूदते हैं ।,सा. यु. पू.,ಸಾ. ಶ.,ಸಾ. ಶ.,ब्रांड नयी सड़कों पर कसबे में टकराते - कूदते हैं ।,نئی سڑک پر ایک نئی سڑک ٹوٹ رہی ہے.,ಸಾ. ಶ.,ब्रांड नयी सड़कों पर कसबे में टकराते - कूदते हैं ।,പുതിയ തെരുവ് ലൈറ്റുകൾ റോഡിനു വെളിയിൽ കിടക്കും.
Tuition kids walk home through complete darkness.,streetlight,Tuition kids walk home through complete darkness.,बच्चों के पूरे अंधकार के माध्यम से घर चलते हैं.,जुआन बच्चे पूरे अंधकार के माध्यम से घर फिरते हैं.,अंधारावर पाऊस पडतो.,టట్యూന്‍స్‌ പിള്ളേര്‍ పూర్తిగా గాఢాంధకారത്തിലൂടെ ఇంటికి నడిచివెళ్తారు.,టట్యూന്‍స్‌ പിള്ളേര്‍ పూర్తిగా గాఢాంధకారത്തിലൂടെ ఇంటికి నడిచివెళ్తారు.,जुआन बच्चे पूरे अंधकार के माध्यम से घर फिरते हैं.,بیرونی بچے مکمل تاریکی سے گھر جاتے ہیں ۔,టట్యూന്‍స్‌ പിള്ളേര്‍ పూర్తిగా గాఢాంధకారത്തിലൂടെ ఇంటికి నడిచివెళ్తారు.,जुआन बच्चे पूरे अंधकार के माध्यम से घर फिरते हैं.,തുയറ്റ്യോൺ കുട്ടികൾ പൂർണ്ണ ഇരുട്ടിലൂടെ വീട്ടിൽ പോകും.
Uneven lighting creates hazardous shadows everywhere.,streetlight,Uneven lighting creates hazardous shadows everywhere.,प्रकाश - संश्‍लेषण हर जगह ख़तरनाक छाया उत्पन्‍न करता है ।,अन्‍नार्पण न करता अंधकार हर कहीं धोकादायक छाया उत्पन्‍न करता है ।,बर्फ वितळतो.,ಬೆಳಕು ಇಲ್ಲದಿರುವಂಥ ಬೆಳಕು ಎಲ್ಲೆಡೆಯೂ ಅಪಾಯಕರ ನೆರಳನ್ನು ಉಂಟುಮಾಡುತ್ತದೆ.,ಬೆಳಕು ಇಲ್ಲದಿರುವಂಥ ಬೆಳಕು ಎಲ್ಲೆಡೆಯೂ ಅಪಾಯಕರ ನೆರಳನ್ನು ಉಂಟುಮಾಡುತ್ತದೆ.,अन्‍नार्पण न करता अंधकार हर कहीं धोकादायक छाया उत्पन्‍न करता है ।,روشنی کے بغیر روشنی ہر جگہ تباہ‌کُن اثرات پیدا کرتی ہے ۔,ಬೆಳಕು ಇಲ್ಲದಿರುವಂಥ ಬೆಳಕು ಎಲ್ಲೆಡೆಯೂ ಅಪಾಯಕರ ನೆರಳನ್ನು ಉಂಟುಮಾಡುತ್ತದೆ.,अन्‍नार्पण न करता अंधकार हर कहीं धोकादायक छाया उत्पन्‍न करता है ।,ഏഴു പ്രകാശനം എല്ലായിടത്തും അപകടകാരികളായ നിഴലുകൾ സൃഷ്ടിക്കുന്നു.
Streetlight arm completely broken and dangling down.,streetlight,Streetlight arm completely broken and dangling down.,स्ट्रीट ठोस हाथ पूरी तरह टूट गया और नीचे drling.,सड़क की चमक पूरी तरह टूटकर डैंगलिंग नीचे टूट गई.,बर्फ वितळला.,స్ట్రీట్ಲೈట్ ತೋಳ് పూర్తిగా విరిగింది మరియు డౌన్ tanging.,స్ట్రీట్ಲೈట్ ತೋಳ് పూర్తిగా విరిగింది మరియు డౌన్ tanging.,सड़क की चमक पूरी तरह टूटकर डैंगलिंग नीचे टूट गई.,گلیوں کا پردہ مکمل طور پر ٹوٹ کر بند کر دیا.,స్ట్రీట్ಲೈట్ ತೋಳ് పూర్తిగా విరిగింది మరియు డౌన్ tanging.,सड़क की चमक पूरी तरह टूटकर डैंगलिंग नीचे टूट गई.,സ്ട്രീറ്റ് ലൈറ്റ് കൈ മുഴുവൻ ഒടിഞ്ഞു വീണു.
No lighting near emergency hospital entrance gate.,streetlight,No lighting near emergency hospital entrance gate.,आपातकालीन अस्पताल गेट के पास कोई रोशनी नहीं है.,Heure Heple History प्रवेशद्वाराजवळ प्रकाशना न हो रही.,बर्फ पडू शकत नाही.,ಅವಸರವಸರವಾದ ಆಸ್ಪತ್ರೆ ಪ್ರವೇಶ வாசற்பం ಹತ್ತಿರದಲ್ಲಿ ಯಾವುದೇ ಬೆಳಕು ಇಲ್ಲ.,ಅವಸರವಸರವಾದ ಆಸ್ಪತ್ರೆ ಪ್ರವೇಶ வாசற்பం ಹತ್ತಿರದಲ್ಲಿ ಯಾವುದೇ ಬೆಳಕು ಇಲ್ಲ.,Heure Heple History प्रवेशद्वाराजवळ प्रकाशना न हो रही.,بیرونی ہسپتال کے دروازے کے قریب روشنی نہیں ہوتی ۔,ಅವಸರವಸರವಾದ ಆಸ್ಪತ್ರೆ ಪ್ರವೇಶ வாசற்பం ಹತ್ತಿರದಲ್ಲಿ ಯಾವುದೇ ಬೆಳಕು ಇಲ್ಲ.,Heure Heple History प्रवेशद्वाराजवळ प्रकाशना न हो रही.,എമർജൻസി പ്രവേശന കവാടത്തിനടുത്തുള്ള ലൈറ്റ് ഇല്ല.
Pole foundation cracked causing streetlight to tilt.,streetlight,Pole foundation cracked causing streetlight to tilt.,ध्रुव की नींव से सड़क का झुकाव गिर जाता है ।,( g03 10 / 22) [ ਫੁਟਨੋ,सा. यु. पू.,పోల్ ಲ್ಯೂಶನ್ ಫೌಂಡೇಶನ್ ఫ్లాగ్ లైట్ కదుటುವಂತೆ చేస్తుంది.,పోల్ ಲ್ಯೂಶನ್ ಫೌಂಡೇಶನ್ ఫ్లాగ్ లైట్ కదుటುವಂತೆ చేస్తుంది.,( g03 10 / 22) [ ਫੁਟਨੋ,ترقی‌یافتہ بنیادوں کی بنیاد جُرم‌وتشدد کا سبب بنتی ہے ۔,పోల్ ಲ್ಯೂಶನ್ ಫೌಂಡೇಶನ್ ఫ్లాగ్ లైట్ కదుటುವಂತೆ చేస్తుంది.,( g03 10 / 22) [ ਫੁਟਨੋ,പൊ. യു.
Water accumulates inside streetlight causing short-circuits.,streetlight,Water accumulates inside streetlight causing short-circuits.,पानी सड़क की रोशनी के अंदर इकट्ठा होता है जिससे छोटे - छोटे अंग पैदा होते हैं ।,রাস্তার মধ্যে ਪਾਣੀ एकत्र जमते যার ফলে क्षितिज कमी होते.,-वापरेंडी-वापरी-वापरी-हल-हस-हल-हस-हस-हस-हस-हल-हल-हल-हल-ज-हल-हल-हल-हल-ज-हस-हल-हस-हल-हल-हल-ज-हस-,నీటినీటి streflication in reword with screen saver categorys-packages-taptions.,నీటినీటి streflication in reword with screen saver categorys-packages-taptions.,রাস্তার মধ্যে ਪਾਣੀ एकत्र जमते যার ফলে क्षितिज कमी होते.,گلی کی روشنی میں پانی جمع کرتا ہے جس سے تھوڑی دیر کے اندر.,నీటినీటి streflication in reword with screen saver categorys-packages-taptions.,রাস্তার মধ্যে ਪਾਣੀ एकत्र जमते যার ফলে क्षितिज कमी होते.,തെരുവ് ലൈറ്റിന്റെ ഉള്ളിൽ വെള്ളം ശേഖരിക്കുന്നത് ചെറിയ-സിക്കറ്റുകൾ ഉണ്ടാക്കും.
Dark temple area unsafe for evening worshippers.,streetlight,Dark temple area unsafe for evening worshippers.,शाम के वक्‍त गहरे मंदिर के क्षेत्र में उपासना करनेवालों के लिए कोई खतरा नहीं था ।,( ਟੇਢੇ ਟਾਈਪ ਸਾਡੇ ।),सा. यु. पू.,"ಸಾವಕಾಶದ ಆರಾಧಕರಿಗೆ, ಕರಾಳವಾದ ದೇವಾಲಯ ಕ್ಷೇತ್ರದಿಂದ ಸುರಕ್ಷೆ ಇಲ್ಲ.","ಸಾವಕಾಶದ ಆರಾಧಕರಿಗೆ, ಕರಾಳವಾದ ದೇವಾಲಯ ಕ್ಷೇತ್ರದಿಂದ ಸುರಕ್ಷೆ ಇಲ್ಲ.",( ਟੇਢੇ ਟਾਈਪ ਸਾਡੇ ।),شام کے اوقات میں بہت سے لوگ عبادت‌گاہوں میں جمع ہوتے تھے ۔,"ಸಾವಕಾಶದ ಆರಾಧಕರಿಗೆ, ಕರಾಳವಾದ ದೇವಾಲಯ ಕ್ಷೇತ್ರದಿಂದ ಸುರಕ್ಷೆ ಇಲ್ಲ.",( ਟੇਢੇ ਟਾਈਪ ਸਾਡੇ ।),സന്ധ്യാസമയത്ത് ഇരുളടഞ്ഞ ക്ഷേത്രം.
Streetlight glass completely fogged reducing brightness.,streetlight,Streetlight glass completely fogged reducing brightness.,सड़क की चमक धीरे - धीरे कम हो रही थी ।,स्ट्रीटलाइट कांच संपूर्ण रूप से धुंधला दबा हुआ था.,यु. पू.,సా. శ.,సా. శ.,स्ट्रीटलाइट कांच संपूर्ण रूप से धुंधला दबा हुआ था.,سڑکوں پر روشنی کا سایہ پوری طرح کم ہو جاتا ہے ۔,సా. శ.,स्ट्रीटलाइट कांच संपूर्ण रूप से धुंधला दबा हुआ था.,സ്ട്രീറ്റ് ലൈറ്റ് ഗ്ലാസ് പൂർണ്ണമായും കുറയുന്നു.
Bird nests inside streetlights blocking all light.,streetlight,Bird nests inside streetlights blocking all light.,सड़कों के भीतर चिड़ियों के घोंसले सब प्रकाश को घटा देते हैं ।,सड़कों की रोशनी के अन्दर पक्षी की घरेलू छातीएँ सभी प्रकाश को रोक रही हैं ।,प्रकाशाच्या प्रकाशापेक्षा प्रकाशापेक्षा प्रकाशापेक्षा उंच आहे.,வீதிസ്ഥലങ്ങളിലുള്ള പക്ഷിക്കൂട്ടങ്ങള്‍ എല്ലാ വെളിച്ചവും അടച്ചിടുന്നു.,வீதிസ്ഥലങ്ങളിലുള്ള പക്ഷിക്കൂട്ടങ്ങള്‍ എല്ലാ വെളിച്ചവും അടച്ചിടുന്നു.,सड़कों की रोशनी के अन्दर पक्षी की घरेलू छातीएँ सभी प्रकाश को रोक रही हैं ।,پرندے سڑکوں کے اندر تمام روشنی چھپا دیتے ہیں ۔,வீதிസ്ഥലങ്ങളിലുള്ള പക്ഷിക്കൂട്ടങ്ങള്‍ എല്ലാ വെളിച്ചവും അടച്ചിടുന്നു.,सड़कों की रोशनी के अन्दर पक्षी की घरेलू छातीएँ सभी प्रकाश को रोक रही हैं ।,"തെരുവ് ലൈറ്റിനുള്ളിൽ, കൂട് കൂടും. എല്ലാ വെളിച്ചവും ബ്ലോക്ക് ചെയ്യും."
