text,label,text_en,text_hi,text_bn,text_mr,text_te,text_ta,text_gu,text_ur,text_kn,text_or,text_ml
This stretch is full of deep and dangerous potholes.,potholes,This stretch is full of deep and dangerous potholes.,यह दौर गहरे और ख़तरनाक शौचालयों से भरा है ।,ਇਹ ਪੁਲਾੜ खोल व ख़तरनाक षड्यंत्रांनी भरली आहे.,या धोक्याला तोंड देताना आपण कोणती गोष्ट लक्षात ठेवली पाहिजे?,ಈ ಚಾವಣಿಯು ಆಳವಾಗಿ ಮತ್ತು ಅಪಾಯಕರವಾದ ಕಣಿವೆಗಳಿಂದ ತುಂಬಿದೆ.,ಈ ಚಾವಣಿಯು ಆಳವಾಗಿ ಮತ್ತು ಅಪಾಯಕರವಾದ ಕಣಿವೆಗಳಿಂದ ತುಂಬಿದೆ.,ਇਹ ਪੁਲਾੜ खोल व ख़तरनाक षड्यंत्रांनी भरली आहे.,اِس کی وجہ یہ ہے کہ اُن کے جسم میں گہرے اور خطرناک گیلے ہوتے ہیں ۔,ಈ ಚಾವಣಿಯು ಆಳವಾಗಿ ಮತ್ತು ಅಪಾಯಕರವಾದ ಕಣಿವೆಗಳಿಂದ ತುಂಬಿದೆ.,ਇਹ ਪੁਲਾੜ खोल व ख़तरनाक षड्यंत्रांनी भरली आहे.,ഈ നീർത്തടം മുഴുവൻ ആഴവും അപകടകരവും ആണ്.
Water-filled potholes hide how deep they really are.,potholes,Water-filled potholes hide how deep they really are.,वे वास्तव में कितने गहरे हैं जल धोने.,पाण्याने भरे हुए पाटों को छिपा रखा वे वास्तव में किती गहरे हैं.,त्यांना पाणी आवडतं.,నీళ్ళు నింపబడిన కుండ రంధ్రాలు... ... అవి నిజంగా ఎంత లోతైన ఉన్నాయి దాచివుంటాయి.,నీళ్ళు నింపబడిన కుండ రంధ్రాలు... ... అవి నిజంగా ఎంత లోతైన ఉన్నాయి దాచివుంటాయి.,पाण्याने भरे हुए पाटों को छिपा रखा वे वास्तव में किती गहरे हैं.,پانی کے گیس کو چھپانے کے لئے وہ واقعی بہت گہرا ہیں.,నీళ్ళు నింపబడిన కుండ రంధ్రాలు... ... అవి నిజంగా ఎంత లోతైన ఉన్నాయి దాచివుంటాయి.,पाण्याने भरे हुए पाटों को छिपा रखा वे वास्तव में किती गहरे हैं.,"വെള്ളപ്പൊക്കമുള്ള കുപ്പികൾ, അവ ശരിക്കും എത്ര ആഴത്തിൽ ഒളിപ്പിച്ചിരിക്കുന്നു."
The potholes slow down traffic and cause long jams.,potholes,The potholes slow down traffic and cause long jams.,ये घर ट्रैफिक में धीमे पड़ जाते हैं और लंबे समय तक जाम लेते हैं ।,▪ ▪ ▪ (w13 - E 02 / 01) [ ਫੁਟਨੋ,लवकरात लवकर धावणं कठीण असतं.,ವಾಹನ ಸಂಚಾರದ వేగನ್ನು తగ్గిస్తుంది.,ವಾಹನ ಸಂಚಾರದ వేగನ್ನು తగ్గిస్తుంది.,▪ ▪ ▪ (w13 - E 02 / 01) [ ਫੁਟਨੋ,اِس کی وجہ یہ ہے کہ اِس کے ساتھ‌ساتھ بہت زیادہ شراب پینے لگتا ہے ۔,ವಾಹನ ಸಂಚಾರದ వేగನ್ನು తగ్గిస్తుంది.,▪ ▪ ▪ (w13 - E 02 / 01) [ ਫੁਟਨੋ,ഈ കുട്ടകൾ ട്രാഫിക് മന്ദഗതിയിലാക്കി നീണ്ട ജാമുകൾ ഉണ്ടാക്കും.
Potholes are appearing again just after the last repair.,potholes,Potholes are appearing again just after the last repair.,बस पिछली मरम्मत के कुछ ही समय बाद पॉक्स्‌स फिर से आ रहे हैं ।,आखिरी मरम्मत के बाद ही पोटे फिर से दिख रहे हैं.,Abbbbbbbbbbbbbb प्रारंभ करा.,ತೊಟ್ಟಿಗಳು ಕೊನೆಯ ದುರಸ್ತು ಮಾಡಿದ ನಂತರವೇ ಪುನಃ ಕಾಣಿಸಿಕೊಳ್ಳುತ್ತಿವೆ.,ತೊಟ್ಟಿಗಳು ಕೊನೆಯ ದುರಸ್ತು ಮಾಡಿದ ನಂತರವೇ ಪುನಃ ಕಾಣಿಸಿಕೊಳ್ಳುತ್ತಿವೆ.,आखिरी मरम्मत के बाद ही पोटे फिर से दिख रहे हैं.,آخری مرمت کے فوراً بعد اس کی دوبارہ منظر نظر آ رہے ہیں ۔,ತೊಟ್ಟಿಗಳು ಕೊನೆಯ ದುರಸ್ತು ಮಾಡಿದ ನಂತರವೇ ಪುನಃ ಕಾಣಿಸಿಕೊಳ್ಳುತ್ತಿವೆ.,आखिरी मरम्मत के बाद ही पोटे फिर से दिख रहे हैं.,"അവസാന അറ്റകുറ്റപ്പണിക്ക് ശേഷം, പോട്ട്സ് വീണ്ടും പ്രത്യക്ഷപ്പെടുന്നു."
The bus almost toppled because of a large pothole.,potholes,The bus almost toppled because of a large pothole.,बस एक बड़े शौचालय की वजह से गिर पड़ी ।,एक बड़ी पकड़ के कारण बस लगभग गिर गयी ।,बसमध्ये जरासं पाणी भरलं जातं.,పెద్ద కుండల్లో చిక్కుకున్నందువల్ల బస్సు దాదాపు ನೆಲಕಚ್ಚింది.,పెద్ద కుండల్లో చిక్కుకున్నందువల్ల బస్సు దాదాపు ನೆಲಕಚ್ಚింది.,एक बड़ी पकड़ के कारण बस लगभग गिर गयी ।,بس ایک بڑے گھر کی وجہ سے تقریباً تقریباً نیچے گِر گئی ۔,పెద్ద కుండల్లో చిక్కుకున్నందువల్ల బస్సు దాదాపు ನೆಲಕಚ್ಚింది.,एक बड़ी पकड़ के कारण बस लगभग गिर गयी ।,ബസ്സിൽ ഒരു വലിയ കലം കാരണമാണ് .
Riders lose balance due to sudden potholes.,potholes,Riders lose balance due to sudden potholes.,अचानक शौचालयों के कारण सवार संतुलन खो देते हैं.,अचानक पकड़ों के कारण रीडरों में संतुलन कमी हो जाता है.,"[ अभ्यासाचे प्रश् न] १, २.",ಎವರೆಸ್ಟ್‌ ಪರ್ವತಗಳು,ಎವರೆಸ್ಟ್‌ ಪರ್ವತಗಳು,अचानक पकड़ों के कारण रीडरों में संतुलन कमी हो जाता है.,بِلاشُبہ ، لوگ اِس بات کا اندازہ لگاتے ہیں کہ اُن کے گھر والے اُن کی دیکھ‌بھال کر رہے ہیں ۔,ಎವರೆಸ್ಟ್‌ ಪರ್ವತಗಳು,अचानक पकड़ों के कारण रीडरों में संतुलन कमी हो जाता है.,"പെട്ടന്നുള്ള കുപ്പികൾ മൂലം, ""റാഡേഴ്സ്"" (Reards) സമനില തെറ്റുന്നു."
These potholes are a serious risk for elderly pedestrians.,potholes,These potholes are a serious risk for elderly pedestrians.,ये शौचालय वृद्ध लोगों के लिए एक गंभीर ख़तरा हैं ।,"• વ્યભિચાર, हिंसा, हिंसा, हिंसा, हिंसा, हिंसा, हिंसाचार, हिंसाचार, हिंसाचार, हिंसाचार, हिंसाचार, हिंसाचार, हिंसाचार, हिंसाचार, हिंसाचार, हिंसाचार, हिंसाचार, हिंसाचार, हिंसाचार, हिंसाचार, हिंसाचार, अत्याचार, अत्याचार, गल्लूपणा, इत्यादी अत्याचार, गल्लूपणा, इत्यादि, गल्लिम, निर्दयता, निर्दयता, निर्दयता, निर्दयता, निर्दयता, निर्दयता, निर्दय",आज अनेक तरुण वृद्धांची काळजी घेतात.,"ಈ ಗೂಡುಗಳು, ಮುದುಕರಾಗಿರುವ ವೃದ್ಧರ ಕಾಲ್ಬೆರಳುಗಳಿಗೆ ಅಪಾಯಕರವಾದ ಅಪಾಯಗಳಾಗಿವೆ.","ಈ ಗೂಡುಗಳು, ಮುದುಕರಾಗಿರುವ ವೃದ್ಧರ ಕಾಲ್ಬೆರಳುಗಳಿಗೆ ಅಪಾಯಕರವಾದ ಅಪಾಯಗಳಾಗಿವೆ.","• વ્યભિચાર, हिंसा, हिंसा, हिंसा, हिंसा, हिंसा, हिंसाचार, हिंसाचार, हिंसाचार, हिंसाचार, हिंसाचार, हिंसाचार, हिंसाचार, हिंसाचार, हिंसाचार, हिंसाचार, हिंसाचार, हिंसाचार, हिंसाचार, हिंसाचार, हिंसाचार, अत्याचार, अत्याचार, गल्लूपणा, इत्यादी अत्याचार, गल्लूपणा, इत्यादि, गल्लिम, निर्दयता, निर्दयता, निर्दयता, निर्दयता, निर्दयता, निर्दयता, निर्दय",یہ سامان عمررسیدہ لوگوں کیلئے نہایت خطرناک ثابت ہو رہا ہے ۔,"ಈ ಗೂಡುಗಳು, ಮುದುಕರಾಗಿರುವ ವೃದ್ಧರ ಕಾಲ್ಬೆರಳುಗಳಿಗೆ ಅಪಾಯಕರವಾದ ಅಪಾಯಗಳಾಗಿವೆ.","• વ્યભિચાર, हिंसा, हिंसा, हिंसा, हिंसा, हिंसा, हिंसाचार, हिंसाचार, हिंसाचार, हिंसाचार, हिंसाचार, हिंसाचार, हिंसाचार, हिंसाचार, हिंसाचार, हिंसाचार, हिंसाचार, हिंसाचार, हिंसाचार, हिंसाचार, हिंसाचार, अत्याचार, अत्याचार, गल्लूपणा, इत्यादी अत्याचार, गल्लूपणा, इत्यादि, गल्लिम, निर्दयता, निर्दयता, निर्दयता, निर्दयता, निर्दयता, निर्दयता, निर्दय",ഈ കുമിളകൾ വൃദ്ധരായ ശിശുജീവികൾക്ക് ഗുരുതരമായ ഒരപകടമാണ് .
The heavy trucks have made huge potholes in the road.,potholes,The heavy trucks have made huge potholes in the road.,इस भारी ट्रकों ने सड़क में बड़े - बड़े शौचालय बनाए हैं ।,मोटार ट्रकों ने रस्ते में बड़े - बड़े पक्वान्‍नों को बनाया है ।,"या बेटाची लोकसंख्या सुमारे १,००,००० इतकी आहे.",ಭಾರವಾದ ಟ್ರಕ್ಕುಗಳು ರಸ್ತೆಬದಿಯಲ್ಲಿ ದೊಡ್ಡ ದೊಡ್ಡ ಕಣಜಗಳನ್ನು ಮಾಡಿವೆ.,ಭಾರವಾದ ಟ್ರಕ್ಕುಗಳು ರಸ್ತೆಬದಿಯಲ್ಲಿ ದೊಡ್ಡ ದೊಡ್ಡ ಕಣಜಗಳನ್ನು ಮಾಡಿವೆ.,मोटार ट्रकों ने रस्ते में बड़े - बड़े पक्वान्‍नों को बनाया है ।,بڑی ٹرکوں نے سڑک پر بہت زیادہ سامان بنائے ہیں ۔,ಭಾರವಾದ ಟ್ರಕ್ಕುಗಳು ರಸ್ತೆಬದಿಯಲ್ಲಿ ದೊಡ್ಡ ದೊಡ್ಡ ಕಣಜಗಳನ್ನು ಮಾಡಿವೆ.,मोटार ट्रकों ने रस्ते में बड़े - बड़े पक्वान्‍नों को बनाया है ।,ഈ വലിയ ട്രക്കുകൾ റോഡിൽ വലിയ കലക്കങ്ങൾ ഉണ്ടാക്കിയിരിക്കുന്നു.
The road surface has crumbled into multiple potholes.,potholes,The road surface has crumbled into multiple potholes.,सड़क की सतह कई शौचालयों में गिर गयी है ।,सड़क की सतह बहुत से पकवानों में धड़क गयी है ।,प्रकाशाचे महत्त्व पटवून द्या.,சாலைದ ಮೇಲ್ಮೈಯು பன்மடங்கு குழிಗಳಾಗಿ ಒಡೆದಿದೆ.,சாலைದ ಮೇಲ್ಮೈಯು பன்மடங்கு குழிಗಳಾಗಿ ಒಡೆದಿದೆ.,सड़क की सतह बहुत से पकवानों में धड़क गयी है ।,سڑکوں کی سطح بہت سے کمروں میں ٹوٹ گئی ہے.,சாலைದ ಮೇಲ್ಮೈಯು பன்மடங்கு குழிಗಳಾಗಿ ಒಡೆದಿದೆ.,सड़क की सतह बहुत से पकवानों में धड़क गयी है ।,റോഡിന്റെ ഉപരിതലം മൾട്ടിമീറ്ററായി മാറിയിരിക്കുന്നു.
Drivers swerve suddenly to avoid the potholes.,potholes,Drivers swerve suddenly to avoid the potholes.,ड्राइवर अचानक शौचालयों से दूर रहने के लिए विमुक्‍त हो जाते हैं ।,गाड़ी चलाते वक्‍त गाड़ी चलाते वक्‍त गाड़ी चलाते हैं ।,अचानक अचानक अचानक वाईट परिणाम होतात.,బాటిల్‌ துளைలను నివారించేందుకు డ్రైవర్లు అకస్మాత్తుగా దారి మళ్ళారు.,బాటిల్‌ துளைలను నివారించేందుకు డ్రైవర్లు అకస్మాత్తుగా దారి మళ్ళారు.,गाड़ी चलाते वक्‍त गाड़ी चलाते वक्‍त गाड़ी चलाते हैं ।,ڈرائیور بڑی آسانی سے گھروں میں آرام‌دہ گاڑیوں سے دُور رہتے ہیں ۔,బాటిల్‌ துளைలను నివారించేందుకు డ్రైవర్లు అకస్మాత్తుగా దారి మళ్ళారు.,गाड़ी चलाते वक्‍त गाड़ी चलाते वक्‍त गाड़ी चलाते हैं ।,വണ്ടികൾ പെട്ടന്ന് അലഞ്ഞുതിരിയുന്നു.
Night driving is very risky because potholes are not visible.,potholes,Night driving is very risky because potholes are not visible.,रात को गाड़ी चलाना बहुत जोखिम भरा होता है क्योंकि शौचालय दिखाई नहीं देते ।,"रात्री गाडी चालवणे अतिशय धोकेदायक आहे, कारण पक्वान्‍ना दृश्‍य दिसत नाही.",यु. पू.,ವಾಹನ ಚಲಾಯಿಸುವುದು ಅಪಾಯಕಾರಿ.,ವಾಹನ ಚಲಾಯಿಸುವುದು ಅಪಾಯಕಾರಿ.,"रात्री गाडी चालवणे अतिशय धोकेदायक आहे, कारण पक्वान्‍ना दृश्‍य दिसत नाही.",رات کو گاڑی چلاتے وقت بہت خطرناک ہوتا ہے کیونکہ سامان نظر نہیں آتے ۔,ವಾಹನ ಚಲಾಯಿಸುವುದು ಅಪಾಯಕಾರಿ.,"रात्री गाडी चालवणे अतिशय धोकेदायक आहे, कारण पक्वान्‍ना दृश्‍य दिसत नाही.",രാത്രിയിൽ വാഹനം ഓടിക്കുന്നത് വളരെ അപകടകരമാണ് .
Even the main road is full of potholes now.,potholes,Even the main road is full of potholes now.,यहाँ तक कि मुख्य मार्ग अब शौचालयों से भरा है ।,मुख्य सड़क भी अब पकाने से भरा हुआ है.,आता अंधार पडला आहे.,ಮುಖ್ಯ ರಸ್ತೆ కూడా ಈಗ కుండ ಗೂಡುಗಳಿಂದ ತುಂಬಿದೆ.,ಮುಖ್ಯ ರಸ್ತೆ కూడా ಈಗ కుండ ಗೂಡುಗಳಿಂದ ತುಂಬಿದೆ.,मुख्य सड़क भी अब पकाने से भरा हुआ है.,یہاں تک کہ اہم سڑک بھی اب سامان سے بھری ہوئی ہے.,ಮುಖ್ಯ ರಸ್ತೆ కూడా ಈಗ కుండ ಗೂಡುಗಳಿಂದ ತುಂಬಿದೆ.,मुख्य सड़क भी अब पकाने से भरा हुआ है.,പ്രധാന റോഡുകൾ പോലും ഇപ്പോൾ നിറയെ കലപ്പകളാണ്.
This pothole is right at the school gate.,potholes,This pothole is right at the school gate.,यह शौचालय ठीक स्कूल के फाटक में है.,यह पागल स्कूल गेट गेट पर ठीक है.,हा केक स्वादिष्ट आहे.,స్కూళ్ళ ಬಾಗಿಲ దగ్గరే ఈ కుండ రంధ్రం ఉంది.,స్కూళ్ళ ಬಾಗಿಲ దగ్గరే ఈ కుండ రంధ్రం ఉంది.,यह पागल स्कूल गेट गेट पर ठीक है.,یہ سامان اسکول کے پھاٹک پر درست ہے.,స్కూళ్ళ ಬಾಗಿಲ దగ్గరే ఈ కుండ రంధ్రం ఉంది.,यह पागल स्कूल गेट गेट पर ठीक है.,ഈ ചങ്ങാടം സ്കൂളിലെ ഗേറ്റിലാണ്.
Potholes cause constant noise and vibration in our homes.,potholes,Potholes cause constant noise and vibration in our homes.,इसलिए हम अपने घर में लगातार शोर - शराबे करते रहते हैं ।,हमारे घरों में धूम्रपान और धूम्रपान का कारण होता है ।,(ख) या लेखात आपण कोणत्या प्रश् नांवर चर्चा करणार आहोत?,ತೊಟ್ಟಿಗಳು ನಮ್ಮ ಮನೆಗಳಲ್ಲಿ ಸತತವಾಗಿ ಶಬ್ದವನ್ನೂ ಜ್ವಾಲಾಮುಖಿಯನ್ನೂ ಉಂಟುಮಾಡುತ್ತವೆ.,ತೊಟ್ಟಿಗಳು ನಮ್ಮ ಮನೆಗಳಲ್ಲಿ ಸತತವಾಗಿ ಶಬ್ದವನ್ನೂ ಜ್ವಾಲಾಮುಖಿಯನ್ನೂ ಉಂಟುಮಾಡುತ್ತವೆ.,हमारे घरों में धूम्रपान और धूम्रपान का कारण होता है ।,اِس کی وجہ یہ ہے کہ اِن میں سے زیادہ‌تر لوگ اِس بات پر زور دیتے ہیں کہ اُن کے گھروں میں لوگ اُن کے پیغام کو سنیں گے اور اُن سے بات‌چیت کریں گے ۔,ತೊಟ್ಟಿಗಳು ನಮ್ಮ ಮನೆಗಳಲ್ಲಿ ಸತತವಾಗಿ ಶಬ್ದವನ್ನೂ ಜ್ವಾಲಾಮುಖಿಯನ್ನೂ ಉಂಟುಮಾಡುತ್ತವೆ.,हमारे घरों में धूम्रपान और धूम्रपान का कारण होता है ।,തവളകൾ നമ്മുടെ വീടുകളിൽ നിരന്തരം ശബ്ദമുണ്ടാക്കും.
The newly laid road has already developed potholes.,potholes,The newly laid road has already developed potholes.,उस नयी सड़क ने पहले ही शौचालयों को विकसित किया है ।,▪ ▪ • • पक्वान्‍ने - धातु — ▪ (w13 - E 05 / 01),(प्रे. कृत्ये २०: ३५; २ करिंथ.,క్రొత్తగా వేయబడిన రహదారి ಈಗಾಗಲೇ కుండపెంకులు నిర్మించబడ్డాయి.,క్రొత్తగా వేయబడిన రహదారి ಈಗಾಗಲೇ కుండపెంకులు నిర్మించబడ్డాయి.,▪ ▪ • • पक्वान्‍ने - धातु — ▪ (w13 - E 05 / 01),نئی سڑکیں پہلے ہی تیار ہو چکی ہیں ۔,క్రొత్తగా వేయబడిన రహదారి ಈಗಾಗಲೇ కుండపెంకులు నిర్మించబడ్డాయి.,▪ ▪ • • पक्वान्‍ने - धातु — ▪ (w13 - E 05 / 01),നവജാതശിശുക്കളായ റോഡ് ഇപ്പോഴേ വികസിപ്പിച്ചിട്ടുണ്ട്.
Potholes are forcing vehicles to drive on the wrong side.,potholes,Potholes are forcing vehicles to drive on the wrong side.,पॉलैंड्स गलत तरफ से गाड़ी चलाने के लिए गाड़ियों को मजबूर कर रहे हैं ।,पोटे गाड़ी चलाने के लिए गलत ओर गाड़ी चलाते हैं.,अशा वेळी तुम्ही काय करू शकता?,ತೊಟ್ಟಿಗಳು ವಾಹನಗಳನ್ನು ಓಡಿಸುವಂತೆ ಒತ್ತಾಯಿಸುತ್ತವೆ.,ತೊಟ್ಟಿಗಳು ವಾಹನಗಳನ್ನು ಓಡಿಸುವಂತೆ ಒತ್ತಾಯಿಸುತ್ತವೆ.,पोटे गाड़ी चलाने के लिए गलत ओर गाड़ी चलाते हैं.,یو . ایس .,ತೊಟ್ಟಿಗಳು ವಾಹನಗಳನ್ನು ಓಡಿಸುವಂತೆ ಒತ್ತಾಯಿಸುತ್ತವೆ.,पोटे गाड़ी चलाने के लिए गलत ओर गाड़ी चलाते हैं.,പോട്ട്സ് വാഹനങ്ങൾ തെറ്റായ ഭാഗത്തേക്ക് ഓടിക്കാൻ മുൻകൈ എടുക്കുകയാണ്.
Buses splash dirty water from potholes on pedestrians.,potholes,Buses splash dirty water from potholes on pedestrians.,बसों पर शौचालय के प्रवेश - द्वार से गंदे पानी को बंद कर देते हैं ।,पैदल चलनेवालों पर गंदी जल धूम्रपान से बहते हैं ।,पाणी स्वच्छ करा.,ಪಾರಿವಾಳಗಳು ಅಡ್ಡಾದಿಗಳ ಮೇಲೆ కుండ ಗೂಡುಗಳಿಂದ ಮೈಲಿಗಲ್‌ ನೀರನ್ನು ಹಾಯಿಸುತ್ತವೆ.,ಪಾರಿವಾಳಗಳು ಅಡ್ಡಾದಿಗಳ ಮೇಲೆ కుండ ಗೂಡುಗಳಿಂದ ಮೈಲಿಗಲ್‌ ನೀರನ್ನು ಹಾಯಿಸುತ್ತವೆ.,पैदल चलनेवालों पर गंदी जल धूम्रपान से बहते हैं ।,گیس کے برتنوں سے گندے پانی صاف کرتے ہیں ۔,ಪಾರಿವಾಳಗಳು ಅಡ್ಡಾದಿಗಳ ಮೇಲೆ కుండ ಗೂಡುಗಳಿಂದ ಮೈಲಿಗಲ್‌ ನೀರನ್ನು ಹಾಯಿಸುತ್ತವೆ.,पैदल चलनेवालों पर गंदी जल धूम्रपान से बहते हैं ।,"""ബസ്""കൾ (Broads), ചെകിളകളിൽ നിന്നും (Bass) ചതുപ്പുവെള്ളം, പൈതൃകത്തിലെ (Producters), ""ബ്ലാഷ്""കളിൽ നിന്നും (Base) നീന്തുന്നു."
