text,label,text_en,text_hi,text_bn,text_mr,text_te,text_ta,text_gu,text_ur,text_kn,text_or,text_ml
This area is neglected by the authorities.,others,This area is neglected by the authorities.,इस क्षेत्र को अधिकारियों ने नज़रअंदाज़ किया है ।,सरकारी अधिकाऱ्‍यांनी याला तुच्छ लेखले आहे.,या औषधाची गरज आहे.,ఈ ప్రాంతాన్ని అధికారులు నిర్లక్ష్యం చేస్తారు.,ఈ ప్రాంతాన్ని అధికారులు నిర్లక్ష్యం చేస్తారు.,सरकारी अधिकाऱ्‍यांनी याला तुच्छ लेखले आहे.,یہ علاقہ حکام کی طرف سے غفلت میں ہے ۔,ఈ ప్రాంతాన్ని అధికారులు నిర్లక్ష్యం చేస్తారు.,सरकारी अधिकाऱ्‍यांनी याला तुच्छ लेखले आहे.,ഈ പ്രദേശം അധികാരികളെ അവഗണിക്കുന്നു.
The streetlight is a simple yet effective way to deter criminals.,streetlight,The streetlight is a simple yet effective way to deter criminals.,सड़क की रोशनी पापियों को बचाने का एक आसान और असरदार तरीका है ।,अपराधियों को रोकने के लिए सड़क प्रकाश एक सरल परंतु प्रभावकारी मार्ग है ।,(ख) या लेखात आपण कोणत्या प्रश् नांवर चर्चा करणार आहोत?,నేరస్థులను నిరోధించడానికి వీధి వెలుగు సులభమే అయినా సమర్థవంతమైనది.,నేరస్థులను నిరోధించడానికి వీధి వెలుగు సులభమే అయినా సమర్థవంతమైనది.,अपराधियों को रोकने के लिए सड़क प्रकाश एक सरल परंतु प्रभावकारी मार्ग है ।,سڑکیں مجرموں کو روکنے کے لئے سادہ مگر مؤثر طریقہ ہے ۔,నేరస్థులను నిరోధించడానికి వీధి వెలుగు సులభమే అయినా సమర్థవంతమైనది.,अपराधियों को रोकने के लिए सड़क प्रकाश एक सरल परंतु प्रभावकारी मार्ग है ।,"തെരുവിന്റെ വെളിച്ചത്തിൽ, ക്രിമിനൽ ക്രിമിനലിനുള്ള വളരെ എളുപ്പമുള്ള ഒരു വഴിയാണ്."
The garbage is a sculpture that we have to be the first wonder of.,garbage,The garbage is a sculpture that we have to be the first wonder of.,कचरा एक मूर्ति है जिसे हमें सबसे पहले आश्चर्य होना है ।,कचरा হচ্ছে एक मूर्ती جسے ہمیں पहिली আশ্চর্যی بننا ہوگا.,पण हे पाणी गरम असल्यामुळे ते सहजपणे उपलब्ध होत नाही.,"ಕಸವು, ನಾವು ಮೊದಲು ಅದ್ಭುತವಾಗಿರಲೇಬೇಕಾದ ಒಂದು ಶಿಲ್ಪಕಲಾಕೃತಿಯಾಗಿದೆ.","ಕಸವು, ನಾವು ಮೊದಲು ಅದ್ಭುತವಾಗಿರಲೇಬೇಕಾದ ಒಂದು ಶಿಲ್ಪಕಲಾಕೃತಿಯಾಗಿದೆ.",कचरा হচ্ছে एक मूर्ती جسے ہمیں पहिली আশ্চর্যی بننا ہوگا.,کوڑے ایک ایسا مجسّمہ ہے جسے ہمیں سب سے پہلی سوچ کا ہونا ہے۔,"ಕಸವು, ನಾವು ಮೊದಲು ಅದ್ಭುತವಾಗಿರಲೇಬೇಕಾದ ಒಂದು ಶಿಲ್ಪಕಲಾಕೃತಿಯಾಗಿದೆ.",कचरा হচ্ছে एक मूर्ती جسے ہمیں पहिली আশ্চর্যی بننا ہوگا.,ചപ്പുചവറുകൾ ഒരു ശിൽപ്പമാണ്. നമ്മൾ ആദ്യം അത്ഭുതപ്പെടണം.
Too much garbage.,garbage,Too much garbage.,बहुत ज्यादा कचरा.,कूच.,अंडी खूपच गरम असतात.,ಕಸ ಕಸ!,ಕಸ ಕಸ!,कूच.,بہت زیادہ کوڑے.,ಕಸ ಕಸ!,कूच.,ഒരുപാട് ചപ്പുചവറുകൾ.
Kachra sadte-sadte ab keeda lag gail ba.,garbage,Kachra sadte-sadte ab keeda lag gail ba.,कांची उदास एक टस्किया ब्लिला.,Kachra Patte-sadte AbKakea Lagil Ba.,एस. ए. ए. ए. ए.,ഖಶಾഖാ-സാദ്തെ ആബ് eegeda Lega gail baa.,ഖಶಾഖാ-സാദ്തെ ആബ് eegeda Lega gail baa.,Kachra Patte-sadte AbKakea Lagil Ba.,سُرخ رنگ‌برنگی لذیذ کھانے کھانے سے لطف‌اندوز ہو رہے تھے ۔,ഖಶಾഖാ-സാദ്തെ ആബ് eegeda Lega gail baa.,Kachra Patte-sadte AbKakea Lagil Ba.,കാച്ചിറ ദു: ഖം-സദെത്ത് ഗിൽബയുടെ അടുത്തെ ഗിൽബ.
The garbage is a monster that grows every day.,garbage,The garbage is a monster that grows every day.,कचरा एक राक्षस है जो हर दिन बढ़ता है.,कचरा ही एक राक्षस है जो हर दिन बढ़ता है.,प्रत्येक दिवस हा एक प्रकार असतो.,"ಕಸ, ಪ್ರತಿದಿನ ಬೆಳೆಯುವ ഒരു രാಮೋಜನാണ്.","ಕಸ, ಪ್ರತಿದಿನ ಬೆಳೆಯುವ ഒരു രാಮೋಜನാണ്.",कचरा ही एक राक्षस है जो हर दिन बढ़ता है.,آتش‌بازی کا ایک بڑا جال ہے جو ہر روز اُگتا ہے ۔,"ಕಸ, ಪ್ರತಿದಿನ ಬೆಳೆಯುವ ഒരു രാಮೋಜನാണ്.",कचरा ही एक राक्षस है जो हर दिन बढ़ता है.,ചപ്പുചവറുകൾ എല്ലാ ദിവസവും വളരുന്ന ഒരു രാക്ഷസനാണ്.
The streetlight is a novel that we have to enjoy.,streetlight,The streetlight is a novel that we have to enjoy.,सड़क की रोशनी एक ऐसा उपन्यास है जिसका हमें आनंद लेना है ।,सड़क की रौशनी एक उपन्यास है जिसे हमें উপভোগ करना पड़ता है.,आमच्या कादंबरीचा जपानीमध्ये अनुवाद केला जातो.,స్ట్ರೀಅನ್‌,స్ట్ರೀಅನ್‌,सड़क की रौशनी एक उपन्यास है जिसे हमें উপভোগ करना पड़ता है.,گلی‌کوچوں ایک ایسی کتاب ہے جو ہمیں لطف‌اندوز ہونے کی ضرورت ہے ۔,స్ట్ರೀಅನ್‌,सड़क की रौशनी एक उपन्यास है जिसे हमें উপভোগ करना पड़ता है.,നമുക്ക് ആസ്വദിക്കേണ്ട ഒരു നോവലാണ് തെരുവ് ലൈറ്റ്.
The road is a novel that we have to be the first homecoming of.,potholes,The road is a novel that we have to be the first homecoming of.,मार्ग एक उपन्यास है जिसे हमें सबसे पहले लौटना है ।,"सड़क एक उपनगर है, जिसे हमें सबसे पहली स्थल पर जाना होगा.",आमच्या नगरात एक जपानी मुलगी आहे.,రహదారి గత ವರ್ಷ.,రహదారి గత ವರ್ಷ.,"सड़क एक उपनगर है, जिसे हमें सबसे पहली स्थल पर जाना होगा.",سڑک ایک بہت ہی عجیب بات ہے کہ ہمیں پہلے واپسی کی ضرورت ہے.,రహదారి గత ವರ್ಷ.,"सड़क एक उपनगर है, जिसे हमें सबसे पहली स्थल पर जाना होगा.",റോഡ് ഒരു നോവലാണ്.. നമ്മൾ ആദ്യം വരുന്ന ആദ്യത്തെ വീട്ടിലെത്തണം.
Light band hone se aawara ladke ghumte hain.,streetlight,Light band hone se aawara ladke ghumte hain.,प्रकाश दल एक बैंची बालक हा.,लाइट बँड हॉन ऐवारा लड़का gumte Hin.,चंद्रावर एक मोठा दगड ठेवला होता.,இலேசான நிலப்பகுதி.,இலேசான நிலப்பகுதி.,लाइट बँड हॉन ऐवारा लड़का gumte Hin.,روشنی میں چلنے والے لوگوں کی تعداد بڑھتی جا رہی ہے ۔,இலேசான நிலப்பகுதி.,लाइट बँड हॉन ऐवारा लड़का gumte Hin.,ലൈറ്റ് ബംഗ്ലാദേശ് ഒരു ഭീമസേനയെ ആലിംഗനം ചെയ്യുന്നു.
The streetlight is a play that we have to be the emperor of.,streetlight,The streetlight is a play that we have to be the emperor of.,सड़क की रोशनी एक खेल है कि हमें सम्राट होना है.,सड़क की चमक एक नाटक है जो हमें सम्राट होना चाहिए.,रोमी अधिकाऱ् यांनी आम्हाला सांगितलं की आम्ही रोमी नागरिक आहोत.,స్ట్రీట్‌ లైట్‌ మనం చక్రవర్తిగా ఉండాలని ఒక నాటకం.,స్ట్రీట్‌ లైట్‌ మనం చక్రవర్తిగా ఉండాలని ఒక నాటకం.,सड़क की चमक एक नाटक है जो हमें सम्राट होना चाहिए.,سڑک ایک ایسا کھیل ہے جسے ہمیں بادشاہ ہونا ہے۔,స్ట్రీట్‌ లైట్‌ మనం చక్రవర్తిగా ఉండాలని ఒక నాటకం.,सड़क की चमक एक नाटक है जो हमें सम्राट होना चाहिए.,നമ്മൾ ചക്രവർത്തിയാകേണ്ട ഒരു നാടകമാണ് തെരുവ് ലൈറ്റ്.
The streetlight is a dance that we have to be the first exploration of.,streetlight,The streetlight is a dance that we have to be the first exploration of.,सड़क की रोशनी एक नृत्य है कि हमें सबसे पहले खोज करनी है.,सड़क की चमक एक नृत्य है जो हमें सबसे पहले शोध करना होगा.,आम्ही रस्त्यात आहोत. आम्ही रस्त्यात आहोत.,వీధి కాంతి అనేది ఒక నృత్యం.,వీధి కాంతి అనేది ఒక నృత్యం.,सड़क की चमक एक नृत्य है जो हमें सबसे पहले शोध करना होगा.,سڑک ایک رقص ہے جس کے ہمیں پہلے حصہ ہونا ہے۔,వీధి కాంతి అనేది ఒక నృత్యం.,सड़क की चमक एक नृत्य है जो हमें सबसे पहले शोध करना होगा.,തെരുവ് ലൈറ്റ് ഒരു നൃത്തമാണ്. നമുക്ക് ആദ്യമായുള്ള നൃത്തം ചെയ്യണം.
The main streetlight of our area is faulty.,streetlight,The main streetlight of our area is faulty.,हमारे क्षेत्र का मुख्य सड़क - पथ ग़लत है ।,हमारे क्षेत्र ਦੀ मुख्य ਸੜਕ ਦੀ सिलसिला ग़लत ਹੈ ।,आमच्या गावातली लोकं सार्वजनिक ठिकाणी राहतात.,మా ప్రాంతంలోని ప్రధాన వీధి లైట్‌ లోపించింది.,మా ప్రాంతంలోని ప్రధాన వీధి లైట్‌ లోపించింది.,हमारे क्षेत्र ਦੀ मुख्य ਸੜਕ ਦੀ सिलसिला ग़लत ਹੈ ।,ہمارے علاقے کی مرکزی سڑک غلط ہے.,మా ప్రాంతంలోని ప్రధాన వీధి లైట్‌ లోపించింది.,हमारे क्षेत्र ਦੀ मुख्य ਸੜਕ ਦੀ सिलसिला ग़लत ਹੈ ।,നമ്മുടെ പ്രദേശത്തിന്റെ പ്രധാന തെരുവ് ലൈറ്റ് തെറ്റാണ്.
The garbage is a novel that we have to be the first rebirth of.,garbage,The garbage is a novel that we have to be the first rebirth of.,कचरा एक ऐसा उपन्यास है जिसे हमें पहले मानना पड़ता है ।,कचरा ही एक उपन्यास आहे.,आम्ही एका कादंबरीचा अनुवाद केला आहे.,"చెత్తವು, ನಾವು ಮೊದಲ ಬಾರಿ ಪುನರುತ್ಥಿತರಾಗಿರಬೇಕಾದ ಒಂದು ನಾಣ್ಯವಾಗಿದೆ.","చెత్తವು, ನಾವು ಮೊದಲ ಬಾರಿ ಪುನರುತ್ಥಿತರಾಗಿರಬೇಕಾದ ಒಂದು ನಾಣ್ಯವಾಗಿದೆ.",कचरा ही एक उपन्यास आहे.,کوڑے ایک ایسی کہانی ہے جسے ہمیں سب سے پہلے ہونا ہے۔,"చెత్తವು, ನಾವು ಮೊದಲ ಬಾರಿ ಪುನರುತ್ಥಿತರಾಗಿರಬೇಕಾದ ಒಂದು ನಾಣ್ಯವಾಗಿದೆ.",कचरा ही एक उपन्यास आहे.,ഈ ചപ്പുചവറുകൾ ഒരു നോവൽ ആണ്. നമ്മൾ ആദ്യത്തെ റീജന്റായി മാറണം.
The road is a dance that we have to be the first step of.,potholes,The road is a dance that we have to be the first step of.,सड़क एक नृत्य है जो हमें पहला क़दम होना है ।,सड़क হচ্ছে एक नृत्य जो हमें सबसे पहला कदम होना चाहिए.,(ख) या लेखात आपण कोणत्या प्रश् नांवर चर्चा करणार आहोत?,రహదారి ಒಂದು నృత్యం.,రహదారి ಒಂದು నృత్యం.,सड़क হচ্ছে एक नृत्य जो हमें सबसे पहला कदम होना चाहिए.,سڑک ایک ایسی رقص ہے جسے ہمیں پہلے قدم ہونا ہے۔,రహదారి ಒಂದು నృత్యం.,सड़क হচ্ছে एक नृत्य जो हमें सबसे पहला कदम होना चाहिए.,റോഡ് ഒരു ഡാൻസാണ്. നമുക്ക് ആദ്യ ചുവട് ആവണം.
The garbage is a pile of our collective irresponsibility.,garbage,The garbage is a pile of our collective irresponsibility.,कचरा हमारे सामूहिक असंतुलन का एक ढेर है ।,कचरा අපේ सामूहिक අපද්‍රව්‍ය का एक ढेर है.,आमच्यापुढे आग लागली आहे.,చెత్త మన సంయుక్త కృత్రిమ ശൂന്യത యొక్క ರಾಶಿ.,చెత్త మన సంయుక్త కృత్రిమ ശൂന്യത యొక్క ರಾಶಿ.,कचरा අපේ सामूहिक අපද්‍රව්‍ය का एक ढेर है.,زیورات ہمارے مجموعی نظام کا ڈھیر ہے.,చెత్త మన సంయుక్త కృత్రిమ ശൂന്യത యొక్క ರಾಶಿ.,कचरा අපේ सामूहिक අපද්‍රව්‍ය का एक ढेर है.,ഈ ചപ്പുചവറുകൾ നമ്മുടെ തീവ്രതയുടെ ഒരു കൂമ്പാരമാണ്.
यूज ho gail ba.,others,यूज ho gail ba.,हाँ . . . . . . . . .,elge hogail ba.,सा. यु.,ಥಾ ಹೊ ಗಲ್ಲಿ ba.,ಥಾ ಹೊ ಗಲ್ಲಿ ba.,elge hogail ba.,بازاروں میں کھانے پینے کی چیزیں ۔,ಥಾ ಹೊ ಗಲ್ಲಿ ba.,elge hogail ba.,❍ ഹോഗിൽ ബേ.
The garbage is a responsibility that we all share.,garbage,The garbage is a responsibility that we all share.,कचरा एक जिम्मेदारी है कि हम सभी को हिस्सा है.,कूच करने की ज़िम्मेदारी हम सब के लिए एक ज़िम्मेदारी है ।,आपण सर्व जण एकत्र मिळून काम करतो.,చెత్త మనమందరమూ పంచుకొనే బాధ్యత.,చెత్త మనమందరమూ పంచుకొనే బాధ్యత.,कूच करने की ज़िम्मेदारी हम सब के लिए एक ज़िम्मेदारी है ।,برا ایک ایسی ذمہ داری ہے جس میں ہم سب شامل ہیں.,చెత్త మనమందరమూ పంచుకొనే బాధ్యత.,कूच करने की ज़िम्मेदारी हम सब के लिए एक ज़िम्मेदारी है ।,ചപ്പുചവറുകൾ ഒരു ഉത്തരവാദിത്തമാണ്. നമ്മൾ എല്ലാവരും പങ്കുവയ്ക്കണം.
Kachra me se jaanwar khana dhoondhte hain aur failate hain.,garbage,Kachra me se jaanwar khana dhoondhte hain aur failate hain.,कांचिया मुझे jajayaka Harghhin एक असफल हािनिन है.,Khachra मुझे से jaanwar dhundhte Huin fuurate hyin.,माझी गाडी पकडणं मला सोपं जाईल.,ഖಾರಾ నాకు sajannar channa dhothth Hoth Hathin 'hare hatin.,ഖಾರಾ నాకు sajannar channa dhothth Hoth Hathin 'hare hatin.,Khachra मुझे से jaanwar dhundhte Huin fuurate hyin.,مَیں نے اُن سے کہا : ” مَیں نے اپنی زندگی یہوواہ خدا کے لئے وقف کر دی ہے ۔ “,ഖಾರಾ నాకు sajannar channa dhothth Hoth Hathin 'hare hatin.,Khachra मुझे से jaanwar dhundhte Huin fuurate hyin.,കാച്രാ എന്നെ ജാനവാർഖാന്റെ ഡിഹോൺഹാഡ് ഹൌറിൻ കൊള്ളയടിക്കുകയാണ്.
The road is a symbol of a country's progress.,potholes,The road is a symbol of a country's progress.,सड़क एक देश की प्रगति का प्रतीक है.,सड़क হল দেশ की प्रगतिનું प्रतीक।,यु. पू.,రహదారి ఒక దేశం యొక్క పురోగతి చిహ్నం.,రహదారి ఒక దేశం యొక్క పురోగతి చిహ్నం.,सड़क হল দেশ की प्रगतिનું प्रतीक।,سڑک ایک ملک میں ترقی کی علامت ہے.,రహదారి ఒక దేశం యొక్క పురోగతి చిహ్నం.,सड़क হল দেশ की प्रगतिનું प्रतीक।,റോഡ് ഒരു രാജ്യത്തിന്റെ പുരോഗതിയുടെ പ്രതീകമാണ്.
The streetlight is a silent protector of the citizens.,streetlight,The streetlight is a silent protector of the citizens.,सड़क की रोशनी नागरिकों का एक मौन रक्षक है ।,सड़क की रौशनी नागरिकों का चुपचाप संरक्षक है।,शहरात शांतीचे वातावरण आहे.,వీధి వీధిపక్కన పౌరుల మౌన సంరక్షణ.,వీధి వీధిపక్కన పౌరుల మౌన సంరక్షణ.,सड़क की रौशनी नागरिकों का चुपचाप संरक्षक है।,سڑک شہریوں کا ایک خاموش محافظ ہے.,వీధి వీధిపక్కన పౌరుల మౌన సంరక్షణ.,सड़क की रौशनी नागरिकों का चुपचाप संरक्षक है।,തെരുവ് ലൈറ്റ് പൗരന്മാരുടെ നിശബ്ദമാണ്.
The streetlight is a small detail that can make a big difference in the overall look of a,streetlight,The streetlight is a small detail that can make a big difference in the overall look of a,"सड़क की रोशनी एक छोटी - सी चीज़ है, जो पूरी तरह एक इंसान को अलग - अलग दिशा में ले जा सकती है",रस्त्याचा प्रकाश एक छोटीशी सविस्तर माहिती आहे जो सबंध ग्रहावर मोठा प्रभाव पाडू शकते,[ चित्राचे श्रेय],వీధుల వెలుగు అనేది ఒక పెద్ద సొరంగంలో గొప్ప మార్పును తీసుకువచ్చే చిన్న ವಿವರ.,వీధుల వెలుగు అనేది ఒక పెద్ద సొరంగంలో గొప్ప మార్పును తీసుకువచ్చే చిన్న ವಿವರ.,रस्त्याचा प्रकाश एक छोटीशी सविस्तर माहिती आहे जो सबंध ग्रहावर मोठा प्रभाव पाडू शकते,سڑک ایک چھوٹی سی تفصیل ہے جو کسی سطح پر بہت فرق کر سکتا ہے,వీధుల వెలుగు అనేది ఒక పెద్ద సొరంగంలో గొప్ప మార్పును తీసుకువచ్చే చిన్న ವಿವರ.,रस्त्याचा प्रकाश एक छोटीशी सविस्तर माहिती आहे जो सबंध ग्रहावर मोठा प्रभाव पाडू शकते,"തെരുവ് വെളിച്ചമാണ്, ഒരു കാഴ്ചയിൽ വലിയ വ്യത്യാസം ഉണ്ടാക്കാൻ കഴിയുന്ന ഒരു ചെറിയ വിശദാംശം"
The garbage is a sign of our times.,garbage,The garbage is a sign of our times.,कचरा हमारे समय का एक संकेत है ।,කුණු කසළ हे हमारे زمانے ਦਾ एक ලකුණ है.,हा रस्ता कधीकधी धोक्यात असतो.,చెత్త ನಮ್ಮ காலத்துக்கு ಸೂಚನೆಯಾಗಿದೆ.,చెత్త ನಮ್ಮ காலத்துக்கு ಸೂಚನೆಯಾಗಿದೆ.,කුණු කසළ हे हमारे زمانے ਦਾ एक ලකුණ है.,کوڑے ہمارے زمانے کا ایک نشان ہے.,చెత్త ನಮ್ಮ காலத்துக்கு ಸೂಚನೆಯಾಗಿದೆ.,කුණු කසළ हे हमारे زمانے ਦਾ एक ලකුණ है.,ചപ്പുചവറുകൾ നമ്മുടെ കാലത്തിന്റെ ഒരു അടയാളമാണ്.
The road is a journey,potholes,The road is a journey,मार्ग एक यात्रा है,ਰਾਹ ایک सफ़र ہے,"४, ५.",ರಸ್ತೆ ಒಂದು ಪ್ರಯಾಣ ಪ್ರಯಾಣ.,ರಸ್ತೆ ಒಂದು ಪ್ರಯಾಣ ಪ್ರಯಾಣ.,ਰਾਹ ایک सफ़र ہے,راستہ ایک سفر ہے,ರಸ್ತೆ ಒಂದು ಪ್ರಯಾಣ ಪ್ರಯಾಣ.,ਰਾਹ ایک सफ़र ہے,റോഡ് ഒരു യാത്രയാണ്.
