text,label,text_en,text_hi,text_bn,text_mr,text_te,text_ta,text_gu,text_ur,text_kn,text_or,text_ml
The road is a challenge that we have to overcome.,potholes,The road is a challenge that we have to overcome.,मार्ग एक चुनौती है जिस पर हमें विजय पाना है ।,( યશા.,(ख) या लेखात आपण कोणत्या प्रश् नांवर चर्चा करणार आहोत?,ರಸ್ತೆಯು ನಾವು ಜಯಿಸಬೇಕಾದ ಒಂದು ಪಂಥಾಹ್ವಾನವಾಗಿದೆ.,ರಸ್ತೆಯು ನಾವು ಜಯಿಸಬೇಕಾದ ಒಂದು ಪಂಥಾಹ್ವಾನವಾಗಿದೆ.,( યશા.,یہ راستہ ایک چیلنج ہے جس پر غالب آنا ہمارے لئے مشکل ہے ۔,ರಸ್ತೆಯು ನಾವು ಜಯಿಸಬೇಕಾದ ಒಂದು ಪಂಥಾಹ್ವಾನವಾಗಿದೆ.,( યશા.,നമ്മൾ ജയിക്കേണ്ട ഒരു വെല്ലുവിളിയാണ് റോഡ്.
The streetlight is a way to foster a sense of belonging.,streetlight,The streetlight is a way to foster a sense of belonging.,सड़क की रोशनी लोगों की समझ बढ़ाने का एक तरीका है ।,▪ ▪ ▪ (w13 - E 02 / 01) [ ਕ੍ਰੈਡਿਟ ਲਾਈਨ],सा. यु. पू.,"వీధుల వెలుగు, తమకు చెందినవారమనే భావాన్ని పెంచుకోవడానికి ఒక మార్గం.","వీధుల వెలుగు, తమకు చెందినవారమనే భావాన్ని పెంచుకోవడానికి ఒక మార్గం.",▪ ▪ ▪ (w13 - E 02 / 01) [ ਕ੍ਰੈਡਿਟ ਲਾਈਨ],اِس کی وجہ یہ ہے کہ اُن کے گھر والے اُن کے ساتھ بات‌چیت کرتے ہیں ۔,"వీధుల వెలుగు, తమకు చెందినవారమనే భావాన్ని పెంచుకోవడానికి ఒక మార్గం.",▪ ▪ ▪ (w13 - E 02 / 01) [ ਕ੍ਰੈਡਿਟ ਲਾਈਨ],അതിന്റെ ഉടമസ്ഥന്റെ ബോധം പരിപോഷിപ്പിക്കാനുള്ള ഒരു മാർഗമാണ് തെരുവ് ലൈറ്റ് .
The light is making a strange buzzing sound.,streetlight,The light is making a strange buzzing sound.,प्रकाश एक अजीब आवाज़ बना रहा है.,उजियाला एक अजीब बाजिंग آواز बन रही है.,विचित्र आवाज आहे.,ಬೆಳಕು ಒಂದು ವಿಚಿತ್ರವಾದ ಧ್ವನಿಯನ್ನು ಉಂಟುಮಾಡುತ್ತಿದೆ.,ಬೆಳಕು ಒಂದು ವಿಚಿತ್ರವಾದ ಧ್ವನಿಯನ್ನು ಉಂಟುಮಾಡುತ್ತಿದೆ.,उजियाला एक अजीब बाजिंग آواز बन रही है.,روشنی ایک حیرت‌انگیز آواز بن رہی ہے ۔,ಬೆಳಕು ಒಂದು ವಿಚಿತ್ರವಾದ ಧ್ವನಿಯನ್ನು ಉಂಟುಮಾಡುತ್ತಿದೆ.,उजियाला एक अजीब बाजिंग آواز बन रही है.,ഈ വെളിച്ചം അവിശ്വസനീയമായ ശബ്ദമാണ് ഉണ്ടാക്കുന്നത്.
The streetlight is a service that should be provided to all.,streetlight,The streetlight is a service that should be provided to all.,सड़क की रोशनी एक ऐसी सेवा है जिसे सभी को दिया जाना चाहिए ।,"सड़क प्रकाश, एक ऐसी सेवा है जो सभी को दी जानी चाहिए ।",हे काम अतिशय महत्त्वाचे आहे.,స్ట్రీట్‌ లైట్‌ అందరికీ ఇవ్వాల్సిన ఒక సేవ.,స్ట్రీట్‌ లైట్‌ అందరికీ ఇవ్వాల్సిన ఒక సేవ.,"सड़क प्रकाश, एक ऐसी सेवा है जो सभी को दी जानी चाहिए ।",گلی‌کوچوں ایک ایسی خدمت ہے جسے سب کیلئے فراہم کِیا جانا چاہئے ۔,స్ట్రీట్‌ లైట్‌ అందరికీ ఇవ్వాల్సిన ఒక సేవ.,"सड़क प्रकाश, एक ऐसी सेवा है जो सभी को दी जानी चाहिए ।",എല്ലാവർക്കും നൽകുന്ന ഒരു സേവനമാണ് തെരുവ് ലൈറ്റ് .
No cleaning.,garbage,No cleaning.,नहीं सफाई.,ਸਫ਼ਾਈ नहीं.,दूध पिऊ नका.,ಶುದ್ಧವಾಗಿಡಲು ಯಾವುದೇ ಸ್ಥಳವಿಲ್ಲ.,ಶುದ್ಧವಾಗಿಡಲು ಯಾವುದೇ ಸ್ಥಳವಿಲ್ಲ.,ਸਫ਼ਾਈ नहीं.,کوئی صفائی نہیں.,ಶುದ್ಧವಾಗಿಡಲು ಯಾವುದೇ ಸ್ಥಳವಿಲ್ಲ.,ਸਫ਼ਾਈ नहीं.,വൃത്തിയാക്കരുത്.
The garbage is a sculpture that we have to be the first journey of.,garbage,The garbage is a sculpture that we have to be the first journey of.,कचरा एक मूर्ति है जो हमें सबसे पहले यात्रा करनी है ।,कचरा ही एक मूर्ती है जिसे ہمیں प्रथम سفر होना पड़ेगा.,आता आम्ही मातीच्या भांड्याप्रमाणे आहोत.,"ಕಸ, ನಾವು ആദ്യ ಪ್ರಯಾಣವಾಗಿ ಮಾಡಬೇಕಾದ ಒಂದು ಶಿಲ್ಪಕಲಾಕೃತಿ.","ಕಸ, ನಾವು ആദ്യ ಪ್ರಯಾಣವಾಗಿ ಮಾಡಬೇಕಾದ ಒಂದು ಶಿಲ್ಪಕಲಾಕೃತಿ.",कचरा ही एक मूर्ती है जिसे ہمیں प्रथम سفر होना पड़ेगा.,ہْμéہج ́آ °إ3⁄4ك 3⁄4ئ ́آ °إ3⁄4ك,"ಕಸ, ನಾವು ആദ്യ ಪ್ರಯಾಣವಾಗಿ ಮಾಡಬೇಕಾದ ಒಂದು ಶಿಲ್ಪಕಲಾಕೃತಿ.",कचरा ही एक मूर्ती है जिसे ہمیں प्रथम سفر होना पड़ेगा.,ചപ്പുചവറുകൾ ഒരു ശിൽപ്പമാണ്. നമുക്ക് ആദ്യ യാത്രയാകണം.
The municipal corporation is not doing its job.,others,The municipal corporation is not doing its job.,प्रशासनिक निगम अपना काम नहीं कर रहा है.,नगरपालिक निगम अपनी नौकरी नहीं कर रहा है.,कंपनी समर्थीत नाही.,శ. పూ.,శ. పూ.,नगरपालिक निगम अपनी नौकरी नहीं कर रहा है.,کارپوریشن کارپوریشن اپنا کام نہیں کر رہی ہے ۔,శ. పూ.,नगरपालिक निगम अपनी नौकरी नहीं कर रहा है.,മുനിസിപ്പാലിറ്റി കോർപ്പറേഷൻ അതിന്റെ ജോലി ചെയ്യുന്നില്ല.
Gali ke batti kab theek hogi?,streetlight,Gali ke batti kab theek hogi?,गली बल्ला बाबी?,Galika batti Kab ek Hogi?,सा. यु. पू.,ഗാലി കേ വാட்டி കാബ് okie hoki?,ഗാലി കേ വാட்டி കാബ് okie hoki?,Galika batti Kab ek Hogi?,کیا یہ خالق کی کاریگری ہے ؟,ഗാലി കേ വാட்டி കാബ് okie hoki?,Galika batti Kab ek Hogi?,ഗാലി ടീം ബാറ്റീ കെബ് ഹോജി?
Dangerous pothole.,potholes,Dangerous pothole.,खतरनाक शौचालय.,ਖ਼ਤਰਨਾਕ षड्यंत्र.,सापावर क्लिक कर.,அபாயகரமான కుండ.,அபாயகரமான కుండ.,ਖ਼ਤਰਨਾਕ षड्यंत्र.,آرام سے.,அபாயகரமான కుండ.,ਖ਼ਤਰਨਾਕ षड्यंत्र.,അപകടകാരികൾ.
This is not a road,potholes,This is not a road,यह मार्ग नहीं है,اور وہ (کبھی) کسی راہ کا نہیں ہے،,हा रस्ता परिणामकारक नाही,ఇది ರಸ್ತೆ ಅಲ್ಲ,ఇది ರಸ್ತೆ ಅಲ್ಲ,اور وہ (کبھی) کسی راہ کا نہیں ہے،,یہ بستی ایسی راه پر نہیں ہے جو اب تک پہنچنے والی نہیں,ఇది ರಸ್ತೆ ಅಲ್ಲ,اور وہ (کبھی) کسی راہ کا نہیں ہے،,ഇതൊരു റോഡല്ല.
I am going home.,others,I am going home.,मैं घर जा रहा हूँ.,ਮੈਂ ਘਰ ਜਾ ਰਿਹਾ ਹਾਂ.,मी घरी जातोय.,ನಾನು ಮನೆಗೆ ಹೋಗುತ್ತಿದ್ದೇನೆ.,ನಾನು ಮನೆಗೆ ಹೋಗುತ್ತಿದ್ದೇನೆ.,ਮੈਂ ਘਰ ਜਾ ਰਿਹਾ ਹਾਂ.,میں گھر جا رہا ہوں۔,ನಾನು ಮನೆಗೆ ಹೋಗುತ್ತಿದ್ದೇನೆ.,ਮੈਂ ਘਰ ਜਾ ਰਿਹਾ ਹਾਂ.,ഞാൻ വീട്ടിൽ പോകുന്നു.
The garbage is spoiling the beauty of the locality.,garbage,The garbage is spoiling the beauty of the locality.,कचरा इलाके की खूबसूरती को बिगाड़ रहा है ।,[ अभ्यासाचे प्रश्‍न],लोखंडाच्या काचेच्या लाकडापासून बनविलेल्या लाकडापासून बनविलेल्या असतात.,குப்பை ಪ್ರದೇಶದ ಸೌಂದರ್ಯವನ್ನು ಹಾಳುಮಾಡುತ್ತಿದೆ.,குப்பை ಪ್ರದೇಶದ ಸೌಂದರ್ಯವನ್ನು ಹಾಳುಮಾಡುತ್ತಿದೆ.,[ अभ्यासाचे प्रश्‍न],لُوط شہر کی خوبصورتی کو خراب کر رہا ہے ۔,குப்பை ಪ್ರದೇಶದ ಸೌಂದರ್ಯವನ್ನು ಹಾಳುಮಾಡುತ್ತಿದೆ.,[ अभ्यासाचे प्रश्‍न],"ഈ ചപ്പുചവറുകൾ, പ്രദേശത്തിന്റെ സൗന്ദര്യം നശിപ്പിക്കുകയാണ്."
The garbage is a problem that needs immediate attention.,garbage,The garbage is a problem that needs immediate attention.,कचरा एक समस्या है जिसे फ़ौरन ध्यान की ज़रूरत है ।,"कूच करना एक समस्या है, जिसे तात्पर्य ध्यान की ज़रूरत है ।",हे सोपे काम नाही.,குப்பைವು உடனடி ಗಮನವನ್ನು ಅಗತ್ಯಪಡಿಸುವ ಒಂದು ಸಮಸ್ಯೆಯಾಗಿದೆ.,குப்பைವು உடனடி ಗಮನವನ್ನು ಅಗತ್ಯಪಡಿಸುವ ಒಂದು ಸಮಸ್ಯೆಯಾಗಿದೆ.,"कूच करना एक समस्या है, जिसे तात्पर्य ध्यान की ज़रूरत है ।",یہ ایک مسئلہ ہے جسے فوری توجہ کی ضرورت ہے.,குப்பைವು உடனடி ಗಮನವನ್ನು ಅಗತ್ಯಪಡಿಸುವ ಒಂದು ಸಮಸ್ಯೆಯಾಗಿದೆ.,"कूच करना एक समस्या है, जिसे तात्पर्य ध्यान की ज़रूरत है ।",ചപ്പുചവറുകൾ പെട്ടെന്നു ശ്രദ്ധിക്കേണ്ട ഒരു പ്രശ് നമാണ് .
The streetlight is a sculpture that we have to be the first start of.,streetlight,The streetlight is a sculpture that we have to be the first start of.,सड़क की रोशनी एक ऐसी मूर्ति है जिसे हमें शुरू करना है ।,सड़कलाइट एक मूर्ति है जिसे हमें सबसे पहले होना है.,आता आम्ही एका हॉटेलमध्ये आहोत.,"స్ట్రీట్‌ లైట్‌ అనేది ఒక చిత్రలేఖనం, మనం మొదటి మొదటిగా ఉండాలి.","స్ట్రీట్‌ లైట్‌ అనేది ఒక చిత్రలేఖనం, మనం మొదటి మొదటిగా ఉండాలి.",सड़कलाइट एक मूर्ति है जिसे हमें सबसे पहले होना है.,سڑک ایک ایسا مجسّمہ ہے جسے ہمیں پہلی بار ہونا ہے۔,"స్ట్రీట్‌ లైట్‌ అనేది ఒక చిత్రలేఖనం, మనం మొదటి మొదటిగా ఉండాలి.",सड़कलाइट एक मूर्ति है जिसे हमें सबसे पहले होना है.,തെരുവ് ലൈറ്റ് ഒരു ശിൽപ്പമാണ്. നമ്മൾ ആദ്യം തുടങ്ങണം.
Bad road.,potholes,Bad road.,बुरा सड़क.,খারাপ রাস্তা.,वाईट खेळ.,கெட்ட சாலை.,கெட்ட சாலை.,খারাপ রাস্তা.,برا سڑک.,கெட்ட சாலை.,খারাপ রাস্তা.,മോശം റോഡ്.
The road is a constant source of dust pollution.,potholes,The road is a constant source of dust pollution.,मार्ग धूल प्रदूषण का एक निरंतर स्रोत है ।,मार्ग धूल प्रदूषण का निरंतर स्रोत आहे ।,पण हे कसे शक्य आहे?,ರಸ್ತೆಯು ಯಾವಾಗಲೂ ಧೂಳಿನ ಮಾಲಿನ್ಯಕ್ಕೆ ಕಾರಣವಾಗಿರುತ್ತದೆ.,ರಸ್ತೆಯು ಯಾವಾಗಲೂ ಧೂಳಿನ ಮಾಲಿನ್ಯಕ್ಕೆ ಕಾರಣವಾಗಿರುತ್ತದೆ.,मार्ग धूल प्रदूषण का निरंतर स्रोत आहे ।,سڑک مٹی کی آلودگی کا مستقل ذریعہ ہے ۔,ರಸ್ತೆಯು ಯಾವಾಗಲೂ ಧೂಳಿನ ಮಾಲಿನ್ಯಕ್ಕೆ ಕಾರಣವಾಗಿರುತ್ತದೆ.,मार्ग धूल प्रदूषण का निरंतर स्रोत आहे ।,റോഡ് പൊടി മലിനീകരണത്തിന്റെ ഒരു സ്ഥിരം ഉറവിടമാണ് .
The streetlight is a friend of the lonely traveler.,streetlight,The streetlight is a friend of the lonely traveler.,सड़क की रोशनी अकेली यात्री का मित्र है ।,सड़क - उजियाला एक अकेला प्रवासी का मित्र है ।,आळशी माणूस रात्रीच्या वेळी झोपी जातो.,"వీధి వీధిపక్కన, ఒంటరిగా ప్రయాణం చేస్తున్న ప్రయాణికు స్నేహితురాలు.","వీధి వీధిపక్కన, ఒంటరిగా ప్రయాణం చేస్తున్న ప్రయాణికు స్నేహితురాలు.",सड़क - उजियाला एक अकेला प्रवासी का मित्र है ।,گلی‌کوچوں میں مسافروں کا ایک دوست ہے ۔,"వీధి వీధిపక్కన, ఒంటరిగా ప్రయాణం చేస్తున్న ప్రయాణికు స్నేహితురాలు.",सड़क - उजियाला एक अकेला प्रवासी का मित्र है ।,തെരുവ് ലൈറ്റ് ഏകാന്ത യാത്രക്കാരന്റെ സുഹൃത്താണ്.
The streetlight is a play that we have to be the first quest of.,streetlight,The streetlight is a play that we have to be the first quest of.,सड़क की रोशनी एक खेल है कि हम पहली तलाशी होना है.,सड़कलाइट एक नाटक है जो हमें सबसे पहली खोज होनी चाहिए.,आमच्या गाडीला आग लागली आहे.,స్ట్రీట్‌ లైట్‌ మనం మొదటి అన్వేషణగా ఉండాలి.,స్ట్రీట్‌ లైట్‌ మనం మొదటి అన్వేషణగా ఉండాలి.,सड़कलाइट एक नाटक है जो हमें सबसे पहली खोज होनी चाहिए.,سڑک ایک ایسا کھیل ہے جسے ہمیں پہلے تلاش کرنے کی ضرورت ہے۔,స్ట్రీట్‌ లైట్‌ మనం మొదటి అన్వేషణగా ఉండాలి.,सड़कलाइट एक नाटक है जो हमें सबसे पहली खोज होनी चाहिए.,തെരുവ് ലൈറ്റ് ഒരു നാടകമാണ്. നമ്മൾ ആദ്യമായി ഒരു യാത്രാപ്രവർത്തകനാവണം.
The garbage is a testament to our apathy.,garbage,The garbage is a testament to our apathy.,कचरा हमारी उदासीनता के लिए एक वाचा है ।,कचरा අපගේ उदासीनता के लिए एक करार है.,आम्ही समुद्रात पोहलो आहोत.,చెత్త మన ఉదాసీనతకు ఒక నిబంధన.,చెత్త మన ఉదాసీనతకు ఒక నిబంధన.,कचरा අපගේ उदासीनता के लिए एक करार है.,اذیت ہماری بےحسی کا ذمہ‌دار ہے ۔,చెత్త మన ఉదాసీనతకు ఒక నిబంధన.,कचरा අපගේ उदासीनता के लिए एक करार है.,ചപ്പുചവറുകൾ നമ്മുടെ നിരർഥകമാണ്.
Sarak par khali gitti failal ba.,others,Sarak par khali gitti failal ba.,साराकण्डे स्तोली मिलल .,Sarak Parkhli gitti असफलता बा.,Culver Pictures,സാర్క్ parar chali gitty Fill baa.,സാర్క్ parar chali gitty Fill baa.,Sarak Parkhli gitti असफलता बा.,اِس کی کیا وجہ ہے ؟,സാర్క్ parar chali gitty Fill baa.,Sarak Parkhli gitti असफलता बा.,"സാരാക്ക് പാർലർ കിലിറ്റീ, തോൽവി."
Kachra aake uthwa lijiye,garbage,Kachra aake uthwa lijiye,काचरा एक गाकुस लीजी हाँ,Kachra ake uthwa লিजी,From the book The Silddddden,ഖಾಖಾakazaziaziaziiziia.,ഖಾಖಾakazaziaziaziiziia.,Kachra ake uthwa লিजी,کوکو کیلے کا رنگ,ഖಾಖಾakazaziaziaziiziia.,Kachra ake uthwa লিजी,കച്ചറ ഒരു ഉറുപ്പിക live light hair.
The garbage is a problem that requires a collective effort.,garbage,The garbage is a problem that requires a collective effort.,कचरा एक समस्या है जो एक सामूहिक प्रयास की माँग करती है ।,कूच - कूच करना एक समस्या है जिसे सामूहिक प्रयास की आवश्‍यकता आहे.,पण हा धोका कमी होत चालला आहे का?,చెత్తವು ಸಾಮಗ್ರಿ ಪ್ರಯತ್ನವನ್ನು ಅಗತ್ಯಪಡಿಸುವ ಒಂದು ಸಮಸ್ಯೆಯಾಗಿದೆ.,చెత్తವು ಸಾಮಗ್ರಿ ಪ್ರಯತ್ನವನ್ನು ಅಗತ್ಯಪಡಿಸುವ ಒಂದು ಸಮಸ್ಯೆಯಾಗಿದೆ.,कूच - कूच करना एक समस्या है जिसे सामूहिक प्रयास की आवश्‍यकता आहे.,یہ ایک ایسا مسئلہ ہے جو ایک اجتماعی کوشش کا تقاضا کرتا ہے۔,చెత్తವು ಸಾಮಗ್ರಿ ಪ್ರಯತ್ನವನ್ನು ಅಗತ್ಯಪಡಿಸುವ ಒಂದು ಸಮಸ್ಯೆಯಾಗಿದೆ.,कूच - कूच करना एक समस्या है जिसे सामूहिक प्रयास की आवश्‍यकता आहे.,ചപ്പുചവറുകൾ ഒരു കൂട്ടക്കൊലയാണ് .
Kachra ab hamare darwaze tak aa gaya hai.,garbage,Kachra ab hamare darwaze tak aa gaya hai.,कांचा डार्वा डार्वा एक समलैंगिक भाई है।,Kachra Ab hhamb Hamare Dorwaze taka haiy.,सा. यु. पू.,ഖാರಾ ಅbahar tharvaaka thakaa ahahahahahahai.,ഖാರಾ ಅbahar tharvaaka thakaa ahahahahahahai.,Kachra Ab hhamb Hamare Dorwaze taka haiy.,کوکوکو کوکوکو ایک کانے سے بنا دیا جاتا ہے.,ഖാರಾ ಅbahar tharvaaka thakaa ahahahahahahai.,Kachra Ab hhamb Hamare Dorwaze taka haiy.,"കാച്ച്രാ Akrabha Hambar Derview, ഒരു ഗായികയാണ്."
Laptop nhi chal rha hai .,others,Laptop nhi chal rha hai .,लैपटॉप Nyplagaaga.,लैपटॉप nhi चुंबन rahay.,P.S.P.B.B.A.A.P.B.A.A.P.B.A.A.A.P.P.P.A.P.P.P.P.P.B.W.W.B.W.W.W.W. P.P.P.P.P.P.P.W.W.W.W.W.W.W.W.W.W.W. P.W.W.W.W.W.W.W.W.W.W.W.,Laptaki chal rhahahahy.,Laptaki chal rhahahahy.,लैपटॉप nhi चुंबन rahay.,ہم سب ایک دوسرے کے ساتھ مل کر کھانا کھاتے ہیں.,Laptaki chal rhahahahy.,लैपटॉप nhi चुंबन rahay.,ലാപ് ടോപ്പ് Yanka Rh.
The road is a novel that we have to be the first invention of.,potholes,The road is a novel that we have to be the first invention of.,मार्ग एक उपन्यास है जिसे हमें पहला आविष्कार करना है ।,सड़क एक उपनगर है जो हमें पहिला उद्योग बनवावे लागेल.,आम्हाला जपानीमध्ये एक मुलगी आहे.,"ರಸ್ತೆಯು, ನಾವು ಕಂಡುಹಿಡಿಯಬೇಕಾದ ആദ്യത്തെ ನವನವೀನವಾಗಿದೆ.","ರಸ್ತೆಯು, ನಾವು ಕಂಡುಹಿಡಿಯಬೇಕಾದ ആദ്യത്തെ ನವನವೀನವಾಗಿದೆ.",सड़क एक उपनगर है जो हमें पहिला उद्योग बनवावे लागेल.,یہ سڑک ایک کہانی ہے جسے ہمیں پہلی ایجاد ہونا ہے۔,"ರಸ್ತೆಯು, ನಾವು ಕಂಡುಹಿಡಿಯಬೇಕಾದ ആദ്യത്തെ ನವನವೀನವಾಗಿದೆ.",सड़क एक उपनगर है जो हमें पहिला उद्योग बनवावे लागेल.,റോഡ് ഒരു നോവൽ ആണ്. നമ്മൾ ആദ്യം കണ്ടെത്തിയത് ഒരു നോവൽ ആണ്.
The garbage disposal needs a complete overhaul.,garbage,The garbage disposal needs a complete overhaul.,कचरा को पूरी तरह से हिलने की ज़रूरत है ।,कचरा कचरे को नीच करने के लिए एक पूर्ण ओवरहालची आवश्‍यकता आहे.,टायरचा वापर करणे सोपे आहे.,చెత్త ತೆಗೆಯുന്നതിന്‌ ಸಂಪೂರ್ಣವಾಗಿ ಮಾಮೂಲ്‌ ആവശ്യമാണ്‌.,చెత్త ತೆಗೆಯുന്നതിന്‌ ಸಂಪೂರ್ಣವಾಗಿ ಮಾಮೂಲ്‌ ആവശ്യമാണ്‌.,कचरा कचरे को नीच करने के लिए एक पूर्ण ओवरहालची आवश्‍यकता आहे.,"ہْμéہج3⁄4îμéہج3⁄4ْہ"" °إ3⁄4ك",చెత్త ತೆಗೆಯുന്നതിന്‌ ಸಂಪೂರ್ಣವಾಗಿ ಮಾಮೂಲ്‌ ആവശ്യമാണ്‌.,कचरा कचरे को नीच करने के लिए एक पूर्ण ओवरहालची आवश्‍यकता आहे.,ചപ്പുചവറുകൾക്ക് ഒരു സമ്പൂർണ്ണാധിപത്യം ആവശ്യമാണ് .
